[
  {
    "rule_id": "GR-0005",
    "rule_name": "Personal data outsourcing governance review",
    "domain": "PRIVACY",
    "priority": 200,
    "when": {
      "data_type": [
        "개인정보"
      ],
      "processing_context": [
        "third_party_or_outsourcing"
      ],
      "destination": [
        "third_party_or_outsourcing"
      ],
      "conditions": [
        "outsourcing_contract_or_supervision_check_required"
      ]
    },
    "evidence_refs": [
      "EV-00014",
      "EV-00018",
      "EV-00020"
    ],
    "decision": {
      "action": "REVIEW",
      "required_controls": [
        "MONITOR"
      ],
      "transform_required": false,
      "human_review_required": true
    },
    "audit": {
      "log_required": true,
      "evidence_trace_required": true
    }
  },
  {
    "rule_id": "GR-0006",
    "rule_name": "Cross-border personal data transfer review",
    "domain": "PRIVACY",
    "priority": 201,
    "when": {
      "data_type": [
        "개인정보"
      ],
      "processing_context": [
        "cross_border_transfer"
      ],
      "destination": [
        "cross_border_transfer"
      ],
      "conditions": [
        "cross_border_transfer_possible",
        "data_subject_notice_check_required"
      ]
    },
    "evidence_refs": [
      "EV-00023"
    ],
    "decision": {
      "action": "REVIEW",
      "required_controls": [],
      "transform_required": false,
      "human_review_required": true
    },
    "audit": {
      "log_required": true,
      "evidence_trace_required": true
    }
  },
  {
    "rule_id": "GR-0008",
    "rule_name": "Information security controls review",
    "domain": "PRIVACY",
    "priority": 202,
    "when": {
      "data_type": [
        "정보처리시스템",
        "전자금융거래",
        "이용자의 비밀번호",
        "AI/SaaS",
        "중요정보"
      ],
      "processing_context": [
        "security_control",
        "ai_use",
        "saas_cloud_use"
      ],
      "destination": [
        "external_ai",
        "saas_cloud"
      ],
      "conditions": [
        "security_control_required",
        "sensitive_or_important_information_processed"
      ]
    },
    "evidence_refs": [
      "EV-00026",
      "EV-00033",
      "EV-00034",
      "EV-00038",
      "EV-00039",
      "EV-00049"
    ],
    "decision": {
      "action": "REVIEW",
      "required_controls": [
        "ENCRYPT",
        "LOG",
        "MONITOR"
      ],
      "transform_required": false,
      "human_review_required": true
    },
    "audit": {
      "log_required": true,
      "evidence_trace_required": true
    }
  },
  {
    "rule_id": "GR-0011",
    "rule_name": "External AI legal and transfer review",
    "domain": "AI",
    "priority": 203,
    "when": {
      "data_type": [
        "인공지능",
        "인공지능시스템",
        "데이터"
      ],
      "processing_context": [
        "ai_use",
        "third_party_or_outsourcing",
        "cross_border_transfer",
        "saas_cloud_use"
      ],
      "destination": [
        "external_ai",
        "third_party_or_outsourcing",
        "cross_border_transfer",
        "saas_cloud"
      ],
      "conditions": [
        "external_ai_use",
        "applicable_law_or_transfer_condition_check_required"
      ]
    },
    "evidence_refs": [
      "EV-00035",
      "EV-00036",
      "EV-00037",
      "EV-00041"
    ],
    "decision": {
      "action": "REVIEW",
      "required_controls": [
        "DETECT"
      ],
      "transform_required": false,
      "human_review_required": true
    },
    "audit": {
      "log_required": true,
      "evidence_trace_required": true
    }
  },
  {
    "rule_id": "GR-0012",
    "rule_name": "SaaS and cloud use review",
    "domain": "SAAS_CLOUD",
    "priority": 204,
    "when": {
      "data_type": [
        "클라우드컴퓨팅서비스",
        "SaaS"
      ],
      "processing_context": [
        "saas_cloud_use",
        "security_control"
      ],
      "destination": [
        "saas_cloud"
      ],
      "conditions": [
        "saas_or_cloud_service_use",
        "network_protection_check_required"
      ]
    },
    "evidence_refs": [
      "EV-00028",
      "EV-00043",
      "EV-00048"
    ],
    "decision": {
      "action": "REVIEW",
      "required_controls": [
        "ENCRYPT"
      ],
      "transform_required": false,
      "human_review_required": true
    },
    "audit": {
      "log_required": true,
      "evidence_trace_required": true
    }
  },
  {
    "rule_id": "GR-0013",
    "rule_name": "General verified evidence routed to compliance review",
    "domain": "PRIVACY",
    "priority": 205,
    "when": {
      "data_type": [
        "개인정보",
        "정보처리시스템",
        "정보보호시스템"
      ],
      "processing_context": [
        "security_control",
        "compliance_review"
      ],
      "destination": [],
      "conditions": [
        "verified_evidence_without_standalone_runtime_decision"
      ]
    },
    "evidence_refs": [
      "EV-00013",
      "EV-00016",
      "EV-00030",
      "EV-00031"
    ],
    "decision": {
      "action": "REVIEW",
      "required_controls": [],
      "transform_required": false,
      "human_review_required": true
    },
    "audit": {
      "log_required": true,
      "evidence_trace_required": true
    }
  },
  {
    "rule_id": "GR-0014",
    "rule_name": "Pseudonymized data governance review",
    "domain": "PRIVACY",
    "priority": 206,
    "when": {
      "data_type": [
        "가명정보"
      ],
      "processing_context": [
        "pseudonymized_data_processing",
        "third_party_or_outsourcing"
      ],
      "destination": [
        "third_party_or_outsourcing"
      ],
      "conditions": [
        "pseudonymized_processing_governance_check_required"
      ]
    },
    "evidence_refs": [
      "EV-00005",
      "EV-00007",
      "EV-00008"
    ],
    "decision": {
      "action": "REVIEW",
      "required_controls": [],
      "transform_required": false,
      "human_review_required": true
    },
    "audit": {
      "log_required": true,
      "evidence_trace_required": true
    }
  },
  {
    "rule_id": "GR-0015",
    "rule_name": "Credit information data subject request review",
    "domain": "PRIVACY",
    "priority": 207,
    "when": {
      "data_type": [
        "신용정보"
      ],
      "processing_context": [
        "credit_information_processing"
      ],
      "destination": [],
      "conditions": [
        "credit_information_data_subject_request_check_required"
      ]
    },
    "evidence_refs": [
      "EV-00011",
      "EV-00012"
    ],
    "decision": {
      "action": "REVIEW",
      "required_controls": [],
      "transform_required": false,
      "human_review_required": true
    },
    "audit": {
      "log_required": true,
      "evidence_trace_required": true
    }
  },
  {
    "rule_id": "GR-0016",
    "rule_name": "Outsourcing publication compliance review",
    "domain": "PRIVACY",
    "priority": 208,
    "when": {
      "data_type": [
        "개인정보"
      ],
      "processing_context": [
        "third_party_or_outsourcing"
      ],
      "destination": [
        "third_party_or_outsourcing"
      ],
      "conditions": [
        "outsourcing_publication_check_required"
      ]
    },
    "evidence_refs": [
      "EV-00017"
    ],
    "decision": {
      "action": "REVIEW",
      "required_controls": [],
      "transform_required": false,
      "human_review_required": true
    },
    "audit": {
      "log_required": true,
      "evidence_trace_required": true
    }
  },
  {
    "rule_id": "GR-0017",
    "rule_name": "Cross-border transfer legal basis and notice review",
    "domain": "PRIVACY",
    "priority": 209,
    "when": {
      "data_type": [
        "개인정보"
      ],
      "processing_context": [
        "cross_border_transfer",
        "third_party_or_outsourcing"
      ],
      "destination": [
        "cross_border_transfer",
        "third_party_or_outsourcing"
      ],
      "conditions": [
        "cross_border_transfer_legal_basis_check_required",
        "data_subject_notice_check_required"
      ]
    },
    "evidence_refs": [
      "EV-00021",
      "EV-00022",
      "EV-00024"
    ],
    "decision": {
      "action": "REVIEW",
      "required_controls": [],
      "transform_required": false,
      "human_review_required": true
    },
    "audit": {
      "log_required": true,
      "evidence_trace_required": true
    }
  },
  {
    "rule_id": "GR-0018",
    "rule_name": "Electronic finance controls requiring human review",
    "domain": "PRIVACY",
    "priority": 210,
    "when": {
      "data_type": [
        "정보처리시스템",
        "운영체제"
      ],
      "processing_context": [
        "security_control"
      ],
      "destination": [],
      "conditions": [
        "source_evidence_review_required"
      ]
    },
    "evidence_refs": [
      "EV-00025",
      "EV-00027"
    ],
    "decision": {
      "action": "REVIEW",
      "required_controls": [],
      "transform_required": false,
      "human_review_required": true
    },
    "audit": {
      "log_required": true,
      "evidence_trace_required": true
    }
  },
  {
    "rule_id": "GR-0019",
    "rule_name": "SaaS and cloud evidence requiring human review",
    "domain": "SAAS_CLOUD",
    "priority": 211,
    "when": {
      "data_type": [
        "SaaS",
        "클라우드컴퓨팅서비스"
      ],
      "processing_context": [
        "saas_cloud_use",
        "security_control"
      ],
      "destination": [
        "saas_cloud"
      ],
      "conditions": [
        "source_evidence_review_required"
      ]
    },
    "evidence_refs": [
      "EV-00029",
      "EV-00044",
      "EV-00045",
      "EV-00046",
      "EV-00047"
    ],
    "decision": {
      "action": "REVIEW",
      "required_controls": [],
      "transform_required": false,
      "human_review_required": true
    },
    "audit": {
      "log_required": true,
      "evidence_trace_required": true
    }
  }
]
